Count,NewDate,Model,Rating,HelpfulYes,Helpfultotal,Date,UserID,Title,Review
0,XX,B002M782UO,5,0,0,11-Apr-14,A1KMNX2SV8YN2Y,easy to clean and various,"Perfect style and easy to  clean, NO MILD,  The boards arrived in a timely manner. The three different  sizes make it easy to select for which chopping project I may have on hand."
1,XX,B002M782UO,4,0,0,9-Apr-14,AZ3CAQCJ2C0TE,Quite Good,Pros: Inexpensive; made out of wood; 3 different sizes in the set; doesn't dull knives; doesn't slide all over the place when using.Cons: Kind of &#34;sheds&#34; splintery bits; have to oil it to keep it from splintering and falling apart; must hand-wash; largest board is still relatively small.
2,XX,B002M782UO,3,0,0,8-Apr-14,AWD9I9BMN5FUM,Okay,"I like having wooden cutting board, but they warped and cracked in the dishwasher. I don't want a cutting board I can't sanitize in the dishwasher."
3,XX,B002M782UO,5,0,0,7-Apr-14,A1LAXUPII82J29,great,Worth the $$ you should get it! on time and enjoy it! don't wait another second! hurry while they last!
5,XX,B002M782UO,1,0,0,6-Apr-14,A115VO3YBPMTFA,They work...,"Just didn't like these, they work just require a lot of maintenance for something that shouldn't&#8230;don't be fooled they're kinda junky&#8230;the first time I washed them they made popping sounds for like 6 hours and upon inspection they small bamboo fibers were literally splitting into little hairs..kind of gross&#8230;you don't need the special oil they say you do, but medical grade mineral oil at your drug store or grocery&#8230;it's cheap and it does the same thing, I oil them about once a week. Honestly wish I had just sent them back."
6,XX,B002M782UO,5,0,0,6-Apr-14,A24A0POE60AVB9,Great,"Yes, just cutting boardsI love them.They are light and vary in size.Getting 3 is a convenience and they are at a good price.Now you can utilize multiples while cooking."
7,XX,B002M782UO,5,0,0,5-Apr-14,A1BU3A7C7BD31P,look nice,"Have had these cutting boards for several months. They look very nice, and we have not had any problems with them breaking or warping."
8,XX,B002M782UO,1,0,0,5-Apr-14,ATSLZ0D687OX,Don't waste your money!,"It did what it was suppose to until today. I used the middle sized board about 4 times and now its starting to split at the handle. Don't waste your money on this, I've only had this for about 6 weeks."
9,XX,B002M782UO,3,0,0,4-Apr-14,AQPAJ3T6IW5DZ,Good buy.,"A bit light, when attempting to cut on them they may slide. So be carful with how you are slicing. The smallest board slid right off the counter while attempting to slice a tomato. Good product for the price, just may not be the best for use as an actual cutting board."
10,XX,B002M782UO,5,0,0,7-Jan-14,A3886QUHLG56UH,cutting boards,There is nothing better in the kitchen then Bamboo cutting boards!!  They fit in the dishwasher if you want and clean up easy.  protects counters and keeps food safe.  Love these!!
11,XX,B002M782UO,5,0,0,7-Jan-14,A38ROKXMSZCCH7,Great set for my needs,I got this for under $10 and love it.  I had used the plastic boards for years and finally gave up on them after having to replace them so often.  I love these boards because they are hard but do not dull my knives.  One piece of advice is to buy some mineral oil at your local pharmacy (walgreens) and rub these boards with the oil as they do not come treated when purchased.
12,XX,B002M782UO,5,0,0,7-Jan-14,A1SRI09RYES35E,liked them,"I orginally bought these cutting boards because they were on sale but after using them, I would have paid full price. I especially enjoy the small cutting board as it doesn't take up much room and still gives you the ability to cut up veggies with ease."
13,XX,B002M782UO,5,0,0,7-Jan-14,A30Z64GON78HMV,Great cutting boards,This is a fine set of boards.  All 3 sizes are useful and they are thin so they leave very little footprint on my countertop when stored leaning against the wall.  Easy to clean.
14,XX,B002M782UO,5,0,0,7-Jan-14,A26DADU2ZQ6SGN,Best Little Cutting Boards In My Kitchen,"Besides the fact that these boards are from Totally Bamboo,  the different sizes and weights of these boards was the reason for buying this set.I had back surgery and could not get to my Totally Bamboo Malibu board and these just seemed to be a better choice right now and I am so glad I bought them. Easy to use, easy to clean, easy to store"
15,XX,B002M782UO,5,0,0,6-Jan-14,AVVIJ7EBPS4EI,Great Environmental Cutting boards,"I really like these cutting boards. A year in of good use and they all look fine. They are easy to clean and I cannot notice any stains on any of them yet. I haven't treated them or used the recommended maintenance and they're still doing well.I have never used these for meat and would be concerned about doing so with such a porous surface, but for veggies and bread these are perfect."
16,XX,B002M782UO,1,0,0,6-Jan-14,AWMG4K2NDNCP8,Need Bamboo Oil?,"These arrived and were smaller than expected.  I measured mine and thought they were about the same, but with the hand hold taken out they are really small.  Also had instructions to soak with bamboo oil.  Who has bamboo oil sitting around?  My wife gave them away before I found out where to get bamboo oil."
17,XX,B002M782UO,5,0,0,5-Jan-14,A1FOXAXSU02MPO,Best cutting boards,"We have tried many others, but these are the best by far. They last for years and look like new even after heavy use. They don't warp or splinter."
18,XX,B002M782UO,5,0,0,4-Jan-14,A321VVGR7UL7P0,really nice,"Great quality.convenient three pack.It is nice to have different sizesfor smaller jobs in the kitchen.Gave as a gift, and they loved it."
19,XX,B002M782UO,5,0,0,3-Jan-14,AJIHYOGV46FEY,Love these,Really nice boards.  Light weight and easy to clean and stay nice looking. I would recommend these to anyone. .
20,XX,B002M782UO,5,0,0,3-Jan-14,A2KZE2TPQ1QO0S,"So far, so good!","I have only used these cutting boards a couple of times, but so far they have held up very well.  They're easy to clean, easy to store and they look really nice.  They are sturdy and provide a nice, flat cutting surface."
21,XX,B002M782UO,5,0,0,3-Jan-14,A3NYHH6I8C28F8,Great Product!,I was looking and looking everyday for a Lightning Deal that I could get and then these popped up at a great price so I couldn't pass it up. I bought and received them very quickly and they're awesome! I can't wait to get some use out of them!
22,XX,B002M782UO,5,0,0,2-Jan-14,A27RL8MHMINRIW,the best I ever had,"I ordered a set like this for myself last year,,,loved them so much I got my son and daughter-in-law a set for Christmas!  Their eyes lit up!"
23,XX,B002M782UO,5,0,0,2-Jan-14,A3RXPJZSGYRTCM,Great cutting boards,"Excellent sizes for everyday use and I love the small one for serving. Bamboo so they're cheap, renewable, and water friendly (more so than most wood, anyway).I have 2 sets and use em both all the time."
24,XX,B002M782UO,5,0,0,2-Jan-14,A3L6Q3MKETJJY0,Great Christmas Gift,Nice and easy to clean.  Very light and easy to handle.  Like the various sizes for different uses.  Came as described.
25,XX,B002M782UO,1,0,0,1-Jan-14,A2INT1M847U0NN,cute but,"gave it as a gift  mom said it was cute but thinner than expected, she cant use it and that directions said she needed bamboo oil - She cant be bothered &#34;with all that&#34; - As soon as I get it from her I plan to return it  - Hopefully the seller can refund - -I will repost later"
26,XX,B002M782UO,5,0,0,1-Jan-14,A31Q53JB9GJE5T,Love it!,My daughter is moving out and these are great starters for my daughter and you can't beat the price! Value!
27,XX,B002M782UO,5,0,0,31-Dec-13,AMDURHPYNYQU5,Great Gift For My Mom!,"These shipped fast as always from Amazon.  Purchased these for my mom who has some arthritis in her hands so I was trying to get something durable, not too heavy and still looks nice on the counter.  This really fit the bill and she really likes them!"
28,XX,B002M782UO,3,0,0,31-Dec-13,A2W0N9ZERSQC44,Have held up well,These cutting boards have held up well for the last year.  Only complaint is the continue to have a glue smell.
29,XX,B002M782UO,5,0,0,28-Dec-13,A1W0704CQHA7AI,Very durable and you can't beat the price!,"I bought these as a Christmas present for my sister. Our father is a five star chef who cooks all over the world. We grew up in a very nice restaurant learning how to cook from a very young age. Cutting boards have always been a fun thing to buy, and very worth spending large amounts of money on for the larger blocks we traditionally use. However, so many times when we are making finger dinners (cheese, nuts, olives, onions, hot sauce, crackers, etc...) we don't want to use the block boards. Having these three lightweight and very durable boards have been VERY handy and easy to clean and store. Also easy to grab for a quick platter. Very nice cutting boards."
30,XX,B002M782UO,5,0,0,25-Dec-13,AALTRDVGZ7IQI,nice,"I bought these for my mom, and they are great.  they are about 3/8&#34; thick, so not heavy at all."
31,XX,B002M782UO,5,0,0,22-Dec-13,A1MPX8JVJONXV7,Great cutting boards~,"They are heavy duty, without being bulky. Very smooth and nice made. The small one in the pack is perfect for sitting pots on."
32,XX,B002M782UO,5,0,0,19-Dec-13,A1FL1QMKTLA92Q,Totally Bamboo 3-pc Cutting Board Set,I gave them to my stepdaughter for a present last year.  She loves them and uses them all the time.
33,XX,B002M782UO,4,0,0,17-Dec-13,A24TKDOPSNGP4U,Product was broken,"This could be from a combination of things. The item arrived with broken handles. Unfortunately some shipping companies throw boxes on the ground, perhaps bubble wrap may have kept this in tact. It looks like a great item, but I chose a refund as this was an anticipated gift."
34,XX,B002M782UO,5,0,0,17-Dec-13,A1QD92DIRX6WIN,Nice cutting boards,"These are nice, quick to grab boards for small cutting jobs in the kitchen. Their size and variety allow you to avoid cross contamination issues."
35,XX,B002M782UO,5,0,0,14-Dec-13,A3A45ANCZ4KWRR,Beautiful,I bought these cutting boards because they were discounted and I needed some for my new apartment. I think these are lovely. It is quite useful that they come in a set of three and they are pretty enough to store in sight in the kitchen.
37,XX,B002M782UO,2,0,2,12-Dec-13,A1CYT5VSN4XCXF,Cheap and made cheap,"Pros:1. Cheap2. Good size (It came with large, medium and small)Cons:1. You would find lots of bamboo debris after dashwashing."
38,XX,B002M782UO,5,0,0,11-Dec-13,A1AGOQTZCT029D,Will last a good while if properly maintained.,"This is my third time purchasing this product. I got it at a great price for cyber monday ($9.99). The product lasts a while if you hand wash it. If you put it in the dishwasher make sure that rub the wood with olive oil every fifth wash otherwise it tends to warp and then crack in  half. Especially the largest of the three boards, I have never had the small one break on me though, Its always the largest one that goes first then the medium one."
39,XX,B002M782UO,4,1,1,10-Dec-13,A29CJR2LAN3LJ0,Quality product,This product is really great.This is a really inexpensive product that allows you to have a classy looking bamboo cutting board set. This item appears sturdy so far.My one complaint is that other reviewers are correct in that the handle is a bit rough. As one reviewer suggested I may try to rub some oils into the product to soften it.For the price I don't think you can go wrong. This was a lovely product.
40,XX,B002M782UO,1,0,0,9-Dec-13,A7CV9IW821SNI,Waste of money,These cutting boards fell apart at the joints in the handles within a week. I bought a set for us and a set as a gift. Thank goodness I had the chance to try them out first. I'll be returning the set I intended as a gift.
41,XX,B002M782UO,5,0,0,7-Dec-13,A3NYN9V6W1S9TM,Great Cutting Board,ordered this product twice now! One for me and one for a friend! We both love the product and would buy them again!
42,XX,B002M782UO,5,0,0,6-Dec-13,A2HBQEJSDN9PR5,thumbs up,I have had these for a few years now and they are only just showing signs of real wear- and I use them all the time! I would happily get another set!
43,XX,B002M782UO,1,0,0,5-Dec-13,ARDVHTCK7WNN8,Poor quality,"I Bought these boards as part amazon lightinig deals. First of all they are relatively small. So if you need a lot of cutting avoid them, I used them for about 4 months total until the big board started breaking down from the joints. Very poor craftsmanship. Avoid"
44,XX,B002M782UO,1,0,0,5-Dec-13,A33E0P4SH55OL,Came warped out of the box,"Super disappointed.  I bought these as a lightning deal last year, and all three came shipped to me already warped. I would have returned them if I did not have to pay for shipping."
45,XX,B002M782UO,2,0,0,5-Dec-13,A3S1SG40YEJHOC,Not everlasting,"These did not last as long as other cutting boards I've had, they eventually became warped. It is nice to have various sizes, though."
46,XX,B002M782UO,3,1,1,4-Dec-13,ACAXV4V8PBCE3,Difficult to cut on,"I bought these because they were bamboo and I had read that using bamboo was good for the environment. These are light and easy to pick up and move around, stay flat/do not warp, but the grain of the bamboo makes them hard to cut on. The surface has just enough ridging to it that it slows down cutting. I prefer a smooth surface where I am not having to fight  to get things cut.I will eventually get rid of these for plastic or some other wood cutting surface that is smoother."
47,XX,B002M782UO,5,0,0,4-Dec-13,A3LBXTBTG5QE1,"good product, no headaches","I haven't had any problems with these boards and with the abuse they took during our garden season i expected some. I would buy them again, if i ever need too."
48,XX,B002M782UO,1,1,1,3-Dec-13,A2KUK56V5DNZ4X,Poor quality.  Not as described.,"This was one of the worst purchases online.  The cutting boards are grainy, and do hold scents.  It does not provide a smooth cutting surface.  Would not give refund!"
49,XX,B002M782UO,2,0,0,2-Dec-13,A1UFPK8HW2L74Q,Broken in few months,It is broken in few months. All the cuting board got crack in center. Better buy some good cutting board
50,XX,B002M782UO,1,3,3,30-Nov-13,A256FWIURNFGRX,"Pretty, but useless","The cutting boards are very pretty, but functionally useless. The bamboo is untreated, so it peels immediately. As soon as I washed them, they started shedding these little hair-like fibers. It's a shame, since they're a great assortment of sizes and very solid. Unfortunately, they're just not very good quality. I returned them immediately, and would advise against buying them. Spend the extra few bucks and get something better."
51,XX,B002M782UO,5,0,0,29-Nov-13,A1HSQ0TC3PEOEK,Bamboo boards,"I love these cutting boards and use them every day for cutting a variety of things: bread, meats, cheeses, veggies, fruits.  For example, the small size is perfect for lemons and limes, and the big one works well for chopping kale and other leafy greens."
52,XX,B002M782UO,1,0,0,26-Nov-13,A3I43PYBXWCKNW,Unimpressed...returned for a refund!,"Very poor quality and not very big at all...flimsy and cheap feeling, and rough surface, not smooth...would not recommend! I purchased these because my Kyocera knives cannot be used on any surface except wood or rubber type surfaces, but these are terrible!"
53,XX,B002M782UO,5,0,0,24-Nov-13,A4LUWNUOR4DDT,"Finally, a bamboo cutting board that doesn't warp or crack (after 5 months)","I love bamboo cutting boards - they look awesome, they don't tend to dull knife blades as bad as some other hard woods, and they are easy to clean (they don't seem to stain as easily as others I've used).I like the three sizes of this set. The smallest, is really too small for any cutting I could think of, but it works well as a small cheese board. The thickness of these is perfect for me. The are light and easy to handle, but just thick enough that I don't think they are going to break anytime soon.After 5 months of frequent use, they haven't warped, split, or broken in any way (that is typically one problem that I have seen with some bamboo cutting boards - these don't seem to have that issue though). One recommendation with these (or any wood cutting board) would be to oil it with either a cutting board oil product (I use &#34;Butcher's Block&#34;) or just mineral oil (much cheaper, and I've heard, just as effective). It can really extend the life of your boards. I tend to get lazy after a few applications, but even 2-3 seems to make a world of difference in reducing warping and cracking of a cutting board.Definitely going to buy from &#34;Totally Bamboo&#34; again."
54,XX,B002M782UO,5,0,0,20-Nov-13,A1YAYINHENFZ7D,Perfect,"Very pretty wood, very usable sizes, smallest would work to serve fruit cheese and crackers for a small group. You can feel the grain."
55,XX,B002M782UO,5,0,0,18-Nov-13,A36PCFM0B780D2,Nice looking; useful and handy sizes,Nice looking cutting board set in handy and useful sizes.  I bought this as a gift for my mother-in-law to go along with a kitchen knife set we bought for her.
56,XX,B002M782UO,1,0,0,15-Nov-13,A2TXUFDN8R1M6B,nice set but will break,the wood peels and because it is bamboo it will split completely once there is a break somewhere on it.
57,XX,B002M782UO,1,0,0,14-Nov-13,A195OX02RPBBPE,Don't waste your money,These are junk...I have had then for 2 weeks...the largest board is broken at the handle and warped.  The other 2 are discolored and beginning to warp.  I wish I would have invested in higher quality.
58,XX,B002M782UO,5,0,0,13-Nov-13,A31DUP99BVTPNL,These boards are beautiful and practicall indestructible. Very useful,"The small piece is an ideal everyday cutting board, cheese board and food tray. The middlel-sized board is ideal for large foods. The large board serves in my shop as a cutting board for thick leather cutting."
59,XX,B002M782UO,5,0,0,9-Nov-13,A3QG3A7OQ3KLQG,Very durable and attractive.,"Love these cutting boards.  They are so attractive and durable.  The sizes are quite useful.  I hang up the two larger ones, the small one drops easily into a drawer.  I have used them for several months and you cannot even tell they have been used.  Very durable!"
60,XX,B002M782UO,3,1,1,6-Nov-13,A51O22M4A3DY6,Dry Wood,"The boards themselves are fine but they weren't very well conditioned. When they arrived, the wood was really dry around the handles. It's nothing a little mineral oil and beeswax won't fix but I can't imagine that they would hold up very well without being treated."
61,XX,B002M782UO,5,0,0,3-Nov-13,A2Y8W2V8PMXA95,TOTALLY BAMBOO 20-7930 3-PIECE CUTTING BOARD SET,The quality of the cutting boards is very good and the boards are very easy to hold.Thank you.Sarah Rosiak
62,XX,B002M782UO,5,0,0,3-Nov-13,AMBJJUSCRE153,Best cutting boards ever!,This are excellent cutting boards and have held up exceptionally well.  The hard bamboo hasn't shown signs of even the slightest scratch and they've been very easy to clean.  I wouldn't be surprised if they also have anti-microbial qualities to them.  These are probably the best cutting boards we've ever owned!  These boards were well worth the purchase price which was very reasonable.
63,XX,B002M782UO,2,0,0,29-Oct-13,A2YT2TNJIT9LL0,"Smaller than expected, already cracked and food sticks to them",Although size specifications were posted they were smaller than I had expected. One of them has already begun to crack and food has a tendency to stick to them. Stick with plastic or hardwood.
64,XX,B002M782UO,4,0,0,29-Oct-13,A28MZ2V00E69D7,Easy present,My mom has many cutting boards but these are probably the best ones she has.Just doing my part to keep women in the kitchen
65,XX,B002M782UO,4,0,0,27-Oct-13,A23EZSCOP16EY8,I like them,"Light weight, easier to clean than larger boards, and a fair price. Very user friendly, decent value, and I like them."
66,XX,B002M782UO,5,0,0,15-Oct-13,A3Q0U1143BFYTU,Oil Your Wood,I had a cutting board before this.....didn't lube it up enough so I split. I got these and some mineral oil. So far so good. Just keep that wood moist.
67,XX,B002M782UO,4,0,0,13-Oct-13,A2Y68BUZJEX7K9,gift for my brother,My brother is a chef and this is a much used item in his kitchenHe wrote meat on one and veggies on the other.
68,XX,B002M782UO,4,0,0,9-Oct-13,A1OYZ9WBR6L41L,Nice set!,"Not quite as thick as I would like, but look nice and are very functional.  I just usedsome Olive oil on them before use, and only a couple times since."
69,XX,B002M782UO,5,0,0,6-Oct-13,A26U5LJIFKU06Y,Eccellent Small Cutting Boards,I have several very nice large cutting boards in my kitchen but since I will be 90 years old next April I do not always want to walk the approximately sixty feet from my bedroom to my kitchen to use one of those boards.  These small very excellent quality cutting boards serve me very well in my bedroom where I have a table and eat most of my meals.
70,XX,B002M782UO,5,0,0,2-Oct-13,AAFGKZONM97UP,they work great at a great price,"they are great for what they are (small cutting boards). have been using them for over 6 months now and haven't had a problem, and for the price if they only last a year i don't much mind. i don't use the smallest one for much of anything, but that is ok. be sure to oil them with mineral oil or another oil you like once a week for a month when you first get them, then just oil it once a month after that. towl them dry when you clean them and store them in a vertical position. they are thin and i bet they would warp pretty easily if you didn't take care. (and when you oil them you don't need much oil, just a drop or three)."
71,XX,B002M782UO,3,1,1,30-Sep-13,A1MQ7OV7OTUOSD,Has splinters coming out,"This bamboo cutting board set is very useful and handy.  I love it.  The only bad thing is that after the first use, it continues to shed tiny splinters.  I am sort of afraid it might be stuck to food that I cut.  I don't think this cutting board is great for its quality."
72,XX,B002M782UO,5,0,0,26-Sep-13,ACDUL6SJIJSB4,Bamboo Cutting Board Set,"Very light, easy to grab, easy to use, very handy. Very light, easy to grab, easy to use, very handy."
73,XX,B002M782UO,3,1,1,23-Sep-13,A269WG8C9O2B0C,"Worked well, didn't last long.","Great value for being used every day but, eventually, the bamboo on two of the three boards split. The mid sized one spilt in three pieces."
74,XX,B002M782UO,3,0,0,22-Sep-13,A2EI1XM746IDME,Gift for Dad,He wanted these boards and is so happy to have them. To me they are similar to the ones I got at walMart
75,XX,B002M782UO,3,1,1,19-Sep-13,A2V4OPO9LDC8TR,Many mixed pieces,"Im worried it is not very strong, so im taking it extra slow and easy on these.  I wished I had gotten the one with the little grooves on it do the liquid didn't run off the board to the counter top."
76,XX,B002M782UO,1,1,1,18-Sep-13,A2ZTS4D78D8PLO,Inferior quality,"If you wanted quality, look elsewhere. Even with oiling, these thin boards didn't hold up well at all.The best one I've found thus far is a pressed composite board that is very dense and has held up beautifully. If I can find the link I will add it."
77,XX,B002M782UO,1,2,2,17-Sep-13,A2TT6R7C3C4VXI,Very disappointed in these boards,"These boards are about half the thickness of other bamboo boards I have.  They were so lightweight, they slid around on my quartz countertops.  The small board is so small it is unusable -- except maybe for slicing a lemon or a lime.The fault was not Amazon's, it lies with the manufacturer.  I am returning these boards."
78,XX,B002M782UO,1,1,1,12-Sep-13,A2Z7MZP0YSOXFA,not worth the material used to make them,These are great if you are only cutting 1 clove of garlic. They are extremely thin. You get what you pay for.
79,XX,B002M782UO,3,0,0,12-Sep-13,A8Y7WFWFYJTU1,Handle broke and boards warped after time,"They lasted a while and then the handle broke. Thankfully it didn't splinter. Not too sure why it broke because I never dropped it or hit anyone with it. Then after taking the peel off of some oranges, I let it sit in the sink for a day and it warped the board. Maybe wet the board on both sides before cutting things that are super juicy. Also don't let it sit with juice just on one side for the whole day like me."
80,XX,B002M782UO,2,0,0,6-Sep-13,A2YY9H2AKCBZ4T,"Small sizes expected, but not the texture","These boards were the size I was expecting, but they were not sealed.  The bamboo is &#34;hairy&#34;...I can't think of another term.  I know that China is one of the sources of bamboo, but I was really hoping this product was from elsewhere...I really didn't want to sand and then oil treat my new cutting boards.  I don't mind oiling them, as I do with other wooden items I own, but having to finish the product is a little much."
81,XX,B002M782UO,3,0,0,2-Sep-13,A1EX6HW3NPD5T1,You Get What You Pay For,These were nice when I first got them. After about 3 months they started bowing. The smallest cutting board has lasted the longest and has been used the most.
82,XX,B002M782UO,5,0,0,2-Sep-13,A27PLXBFN43ETF,Super nice!,These work great! We love them and they have become our favorite cutting boards to use! Definitely worth what we paid for them!
