Count,NewDate,Model,Rating,HelpfulYes,Helpfultotal,Date,UserID,Title,Review
159,XX,B002M782UO,5,0,0,12-Apr-13,A1FMRC8KE0K8PQ,Love them,I bought these in December when amazon was having their special deals. I got them for a great price. We love them. I will never buy a cutting board that isn't made of bamboo.
160,XX,B002M782UO,5,1,1,11-Apr-13,A2I6KBFBFIORH7,Very Nice Cutting Boards,"I bought these boards when Amazon offered them on sale. Our old boards were getting pretty rough, so the offer was timely. These boards are quite nice, exceeding our expectations. They are thin, but not too thin, light and very well made. They are made of laminated bamboo. This material is easier on knife edges than our previous plastic ones yet they are not easily scratched. They must be seasoned with a non-degrading oil, such as mineral oil (not a vegetable oil) before they are used and occasionally thereafter. They must not be cleaned in the dishwasher, but washed by hand with a non-caustic soap and warm water and dried with a dishtowel.They are somewhat more trouble to maintain than plastic or hardwood cutting boards. However, they should last a long time, be easier on our knives, and they are an attractive addition to our kitchen."
161,XX,B002M782UO,3,0,0,11-Apr-13,A14T0OO4U0QHDT,Does the JOB and on sale was great,I use these cutting boards everyday. The only one that is useful is the big one. I gave it 3 stars because I like a small groove on the outside of the board to trap any juice. Other than that it is lightweight and easy to clean. Yup Yup
162,XX,B002M782UO,2,0,0,10-Apr-13,AEEGLS16Y6IDA,Flimsy,"I liked these a lot when I got them. But two of them have split already, and I've never put them in the dishwasher. They seem very lightweight compared to other boards I've had."
163,XX,B002M782UO,4,0,1,8-Apr-13,A2NLP09H0VRPD7,Nice boards,"The set looks great, and I can't wait to  use it.  Someday I hope to get a much  larger board -- for my husband to use after hunting and fishing!  :-)"
164,XX,B002M782UO,5,0,0,8-Apr-13,AX3NJP2M2X1R6,awesome,"I have had many cutting boards. These are great, multiple sizes have been using for 4 months and NO SPLITTING! I hand wash, do not soak them and make sure they dry completely."
165,XX,B002M782UO,1,0,0,6-Apr-13,AQLURIK8X668G,dont waste you time or money,absolute JUNK!!! i washed them in the sink and even used the oil reccomended and they still fell about after a month.. i will NEVER buy these again. not worth the money at all!!
166,XX,B002M782UO,5,0,0,5-Apr-13,A3PAGG5JPJP1Q6,Bamboo,"I was really worried I would get these and they wouldn't be as described, but they are great! Ive had no issues with them at all!"
167,XX,B002M782UO,1,0,0,3-Apr-13,ALV6WM8MZWJMI,Poor Quality,I am reluctant to start using these boards. Strands of bamboo are already peeling off the boards! I am very disappointed.
168,XX,B002M782UO,2,0,0,31-Mar-13,A3H0WPPP6LLKEK,"Lasted for about 6 months, then they split","We bought these as an affordable and environmental alternative to hardwood cutting boards. We researched how to care for cutting boards and followed those guides by only running warm water over the boards and oiling them regularly. Despite these efforts, the boards have since fallen apart. I am someone that tries to keep my environmental impact as low as I reasonably can, but having to replace these boards every six months is not very economical. Therefore, I cannot recommend these cutting boards unless you are simply buying as a first set, on a limited budget in or just coming out of university. Otherwise, invest in something a bit more expensive, in my opinion."
169,XX,B002M782UO,1,0,0,30-Mar-13,AZZC7Z9IRESOJ,EXPENSIVE TO MAINTAIN,Everytihng is good about it except that you have to buy bamboo oil to upkeep these boards...who have time and money to do this??????
170,XX,B002M782UO,5,0,0,29-Mar-13,A1XTL95QY7YPJ8,3 years and counting.,My wife and I purchased this cutting board set 3 years ago when we got married.We enjoy cooking them at home and use them for every meal of the day just about.We wash them with scalding hot water and soap. We have never purchased bamboo oil or done anything that could be considered protective care.After 3 years not one is cracked or splintering or anything. The biggest one is bowed slightly but that was due to me sticking it in the dish washer once.You cannot go wrong purchasing this cutting board set!
171,XX,B002M782UO,4,0,0,28-Mar-13,A1JRDT803KFOKX,Good product,"These are good boards - Can't really say that I &#34;love&#34; them; after all, it's cutting boards :)  I would definitely buy them again however."
172,XX,B002M782UO,5,0,0,28-Mar-13,A2XOPD4ETSFHOI,Bamboo cutting board set,"I like the bamboo cutting board set because it offers different sizes for different jobs, clean up good and convenient."
173,XX,B002M782UO,1,1,1,26-Mar-13,AA2DW1RW2R0CG,Poor Quality,They have already started cracking and breaking after a few months. I completely regret this purchase. Spend the extra money for better quality
174,XX,B002M782UO,5,0,0,26-Mar-13,AOJBKPV6ELTE9,Beautiful bamboo cutting boards,"The small one is, really, pretty small. You can find uses for it, but not that often. They're all beautiful quality, look great in the kitchen, too. Wash real easy, and handle everything great."
175,XX,B002M782UO,4,0,0,25-Mar-13,A1SJ7FOIN8J17C,Bamboo 3-piece cutting board set,"I like the appearance and durability of this cutting board set.  Also, there are three sizes for different cutting needs."
176,XX,B002M782UO,5,0,0,23-Mar-13,ABUX8IR5O88D2,good stuff,This product was exactly what I asked for. Good Stuff. Will order more if I need more kitchen supplies and stuff.
177,XX,B002M782UO,5,0,0,22-Mar-13,A16MLJWGBC7M6A,Great Quality,"Came fast, everything in order. I love them! So easy, lightweight but heavy enough to hold up against cutting heavy roots."
178,XX,B002M782UO,4,0,0,21-Mar-13,A3GQQ1U9S8SJ2H,Great,"We bought this item some where other than Amazon, but the product is great so far. They are durable, and the three different sizes are very convenient when it come to cooking a meal, i can cut meat, vegetables and bread all at the same time! Love it, the only reason I didn't give it a 5 star is because after the first washing, it faded and lost its shine:(. But the product does hold up, and the shinyness doesn't out do the quality:)"
179,XX,B002M782UO,1,1,1,16-Mar-13,A2F10AD8S45DEV,Split and cracked within a couple washes,"I got these as a gift and oiled them after each wash.  They split, cracked and warped terribly.  Not a good product."
180,XX,B002M782UO,4,0,0,15-Mar-13,A2XLLMUQ813QUF,Nice cutting boards,I would make this purchase again. Great investment for your money. I really was confused about the seasoning aspect of it however. Some people state they never season their cutting boards
181,XX,B002M782UO,1,0,0,10-Mar-13,AW0DZWLHHW71T,board were small and the largest one was cracked,very disappointed with this product  not worth the money!wish i could have a replacement for free!i have always prefered bamboo  not to sure now!
182,XX,B002M782UO,2,0,0,9-Mar-13,A9IZL1UGUL2XD,Dry,Could not wait for these board to arrive!!! Well they are here and they are sooooo dry....  I had to buy cutting board oil and treat them several times before they were ok!!! I probably would not buy these again
183,XX,B002M782UO,5,0,0,8-Mar-13,A2Q4C5MYQKMKUB,Great cutting boards,"We have spent some time buying cutting boards that would always break because we were not caring for them appropriately. We simultaneously bought these inexpensive boards and started caring for them. That is washing by hand, drying immediately, and applying oil occasionally. These boards are great."
184,XX,B002M782UO,3,0,0,7-Mar-13,A1O9ZCN0LTKDT6,not much of a cutting board,"These boards are very very thin and wobbly.  They're pretty useless as cutting boards.  However, if you wanted to use them as stylish serving trays (cheese and bread, etc), then they're great.  The do have a somewhat pungent odor - especially when wet."
185,XX,B002M782UO,4,0,0,7-Mar-13,A17FRWQEYG9X0A,I wasn't sure,"These cutting boards are nothing fancy; however, they are manageable, stackable and hearty. They stand up to constant washing and chopping."
186,XX,B002M782UO,2,0,0,3-Mar-13,A135BRTLPJ5C37,Not a quality product,The large cutter board came with a 2 in crack starting in the mid bottom and the middle cutting board is warped and doesn't sit level.
187,XX,B002M782UO,5,0,0,3-Mar-13,AC1H8222OA4V4,Lovely,"Very pleased with these. Thin enough to be lightweight and easily handled, which is very important to someone with arthritis in their hands. But they are not insubstantial or cheap feeling. Beautiful gain in the bamboo."
188,XX,B002M782UO,5,0,0,2-Mar-13,AVIZB1GISRMTT,"light, durable and stylish","surprisingly light weight with a thin profilevery durablealso stylish, either as a contrast element on stone or metal, but can also fit in with country decor of a more traditional wood counters, etc"
189,XX,B002M782UO,5,0,0,26-Feb-13,A35GDANYTOY3K8,very nice wood,very nice wood look and feel;  they seem to take to washing fairly well and do not seem to keep odors
190,XX,B002M782UO,5,0,0,24-Feb-13,A394BUCYS39BAU,love it,"Came with card and everything, I am very happy with the item, came in throw the male just fine thanks."
191,XX,B002M782UO,4,0,0,23-Feb-13,A1D6UKETH3P8B9,great cutting boards for the price,these cutting boards are light weight and good quality.  they're also nice enough to be used to serve food.  at 9.99 they were a steal
192,XX,B002M782UO,5,0,0,22-Feb-13,A110D6U3WVLMQF,Excelente,"Excelente calidad, livianas, buenos tama&ntilde;os, duraderas  . .  . .. . . . . . . . . . ."
193,XX,B002M782UO,4,0,0,22-Feb-13,AXNDH2DADRQTS,Bamboo,"We like the product.  The only complaint is that we wish there was another size larger, otherwise it accommodates all our needs at this time."
194,XX,B002M782UO,4,0,0,21-Feb-13,ATEEM7IQQ870S,good size boards good quality,loved my cutting boards great sizes.  Mine got wet my husband left them outside so I had to throw them out because they warped.  but that was only due to his mistake they are wood.  I will buy some more they were great!
195,XX,B002M782UO,1,0,0,19-Feb-13,A39FXS2Y4G7ZQ,after one week of use broke,after one week of use these were broken. It is good look but poor quality.  I do not recommend this product
196,XX,B002M782UO,4,0,0,18-Feb-13,AAD3Z2QU4OV0F,Enjoying!,Nice and light set of beautiful wood that is also sturdy! ( An old school value in a disposable world!) Washes easily and is showing minmal wear and tear after 2 months of steady use. Remember a little of TLC with oil for conditioning.
197,XX,B002M782UO,2,0,0,17-Feb-13,A2GVV8XJQN7J9L,Be wary of this item.,"I purchased this item and it arrived quick.  I was excited to give the product a try.  I wiped the boards down with some water and dried them off with a towel.  When I came back the next morning I noticed that the mid sized cutting board had bowed.  It wouldn't sit flat anymore and had a small crack in it.  I thought that was strange, so I just tried to push it back.  Well, that was a bad idea because the board split right into 2.The larger board is a little warped now as well, but don't get me wrong it is useable. The smaller one seem absolutely fine.I guess you aren't supposed to wipe these down?  Maybe I just didn't follow the instructions.  Some say theirs broke after 6 months, mine broke immediately.Careful folks you might want to get the oil, or this isn't the product you are looking for."
198,XX,B002M782UO,5,0,0,15-Feb-13,A37NKSD8N4TW50,Great products,"I use these cutting boards daily.  The difference sizes are great for an area with limited counter top space.  They are light weight, yet have a high quality feel."
199,XX,B002M782UO,5,0,0,12-Feb-13,A8A9GCVOUDNFL,"It's real bamboo, you can smell it","It's good quality and finish. The only 'downside' is you can smell the bamboo. I wasn't sure if I need 3 but for this price, why not."
200,XX,B002M782UO,1,0,0,11-Feb-13,A1RBAK09INAUAY,Board has loose slivers like hairs coming off of it,"The board has loose slivers like hairs coming off of it and they can get into food, so I sent them back.I can't say enough about Amazon and how wonderful their return process is, so my review is for the item, not amazon.(Amazon gets 5 stars)."
201,XX,B002M782UO,1,0,0,11-Feb-13,A32918SASHEJTD,Cracks and splinters,"These cutting boards seemed decent upon first opening, lightweight and seemingly sturdy.  However, after the first washing, they all split around the handle area and also at the bottom.  They did not split in half, or into unusual pieces, instead just showed visible splitting in the wood.  I assumed over time, the cracking in the wood grain would travel and break them completely into pieces, but never got that far with these boards.  After first use, the wood splintered where all the knife cuts were.  I wasn't doing any major hacking on these boards, simply cutting potatoes with a chef's knife.  Now, when I say splintered, I mean legitimately splintered, with tiny-sized slivers of wood sticking upright from the board.  Since that was after one use and I don't intend to worry about getting slivers in anything I prepare in the future, I ended up buying a different set of cutting boards.  I would NOT recommend this because really...cracking is one thing (annoying but I can deal with it)...slivers of wood in my food is a whole different unwanted ballgame.  Be cautious when using these boards if you already have a set."
202,XX,B002M782UO,3,0,0,11-Feb-13,A1IC03XNFVWTHS,"Fine, but","The instructions ask you to oil these with mineral oil every day for a month.  I would kind of expect something so tedious to have been done as part of the manufacturing process.  The good news is that 2 months in, they look good and are a little dry, but usable.  Next time, I would probably shell out for a bamboo cutting board that didn't claim to require such extensive treatment.It's also possible that they don't need mineral oil but the company wants me to buy it from them, in which case I would still give them the same star rating for poor sportsmanship..."
203,XX,B002M782UO,5,0,0,10-Feb-13,AIXFXNX9LLZJC,great!,"I love these cutting boards, they are wonderful... my only complaint is that I wish there was one, one size larger. The largest one is just not large enough for me, but other than that they are fantastic."
204,XX,B002M782UO,5,0,1,10-Feb-13,A2I7FNNMP8ALI4,Top quality,Very nice set of cutting boards. Good assortment of sizes. If you love working in the kitchen or have kids who love to make a mess and not do dishes at this price buy 2 sets so you'll always have a clean one ready to work with.
205,XX,B002M782UO,5,0,0,5-Feb-13,A145ZMM9121X3C,Loved this product!,Loved these bamboo cutting boards is a &#34;real bang for your buck&#34;. Very nice and light weight product packaged well.
206,XX,B002M782UO,1,0,0,5-Feb-13,A2ZEOK1MUKS2A4,Bad deal,"After two days of owning the Bamboo 3 piece cutting board set,I washed them after using and the middle cutting board split about six inches down the center of it"
207,XX,B002M782UO,5,0,0,5-Feb-13,A11KZZSU942VH0,Very Nice,Very nice. Arrived as described and as promised. Need to get a bigger one for bread and lager items to cut.
208,XX,B002M782UO,5,0,0,4-Feb-13,A23HWARV5MPDIA,Great!,My new kitchen needed an updated look and these bamboo cutting boards in varying sizes are just what I needed.
209,XX,B002M782UO,2,0,0,3-Feb-13,A17J68BTLVIKW8,Ok,These are ok. I didn't know that bamboo was not dishwasher safe and that's deal breaker for me. Too much maintenance for a cutting board for me personally.
210,XX,B002M782UO,4,0,0,1-Feb-13,A20HOK2OXDYSPU,Splinters a bit,"I have only used the littlest board yet, but it splinters a bit. Hopefully that stops, or maybe I need to prevent that myself, but so far, it works lovely. I cut onions and things like that on it, and it hasn't soaked up the smell."
211,XX,B002M782UO,5,0,0,31-Jan-13,A1PN18XOHIBJ1A,Bamboo cutting boards,I like them a lot and would recommend them.They clean up nicely and look nice in the kitchen. I like them.
212,XX,B002M782UO,3,0,0,31-Jan-13,A1ET757N4QWN56,"Decent, but not exactly what I expected.","These cutting boards arrived VERY quickly. They were much skinnier than I thought they would be, but that might have been from looking at the dimensions incorrectly. I hand wash the cutting boards and every time it seems like particles of food want to stay on the board--even with hot water and soap.  I wouldn't order these again, but they'll do for now!"
213,XX,B002M782UO,3,0,0,30-Jan-13,A2Q3OX8SYM11N,Bamboo 20-7930 3-Piece Cutting Board Set,"I love the fact I received three cutting boards in three different sizes. I also really like the light weight aspect of each cutting board. My issue, the boards are already splintering and pealing from my knife strokes and average use.When I wash them, YIKES. more resin? outer finish? peels off. I've only had them in use about a month. Not sure how much longer they'll last."
214,XX,B002M782UO,4,0,0,30-Jan-13,AH4YHA2L6R9A9,bamboo cutting boards,Great deal for the price! They will last a very long time. I love bamboo. ... ... ... ... ...
215,XX,B002M782UO,3,0,0,30-Jan-13,A1XHPYG3D2WVCM,High maintenance,"Bamboo cutting boards may be beautiful and naturally anti-microbial, but they're very high maintenance. First, I had to purchase mineral oil and use it on the boards a couple of times (the manufacturer recommends daily seasoning for a whole week!). Then, every time I use them, I need to pay extra-care not to leave any water on them for more than it's strictly necessary, which I do; I wash and towel them dry as soon as I'm done cutting, but it doesn't seem to be enough, the boards tend to warp nonetheless.In conclusion, better than plastic perhaps, but not ideal."
216,XX,B002M782UO,5,0,0,30-Jan-13,A3D0HMC6RQT0N0,So far very happy with these...,These are utilitarian but look good enough to serve on as well. They're holding up fine so I'd say it was a good purchase...
217,XX,B002M782UO,3,0,0,28-Jan-13,A321AM8OKRWGQ3,Ehhhh....,"These are ok if you take care of them properly. I found these to be more high maintenance than any other cutting boards I have owned. Mine split and broke apart within a couple months. I take responsibility for it because I was washing them in the dishwasher a lot instead of wiping them down and drying them immediately. So.. if you take care them, I am sure they will do you just fine. The smallest one is veryy small. I hardly ever used it. The other 2 are decent size. Nothing spectacular about these."
218,XX,B002M782UO,3,0,0,28-Jan-13,A2DEZI3TEHERHV,Smaller than I anticipated,"These cutting boards are small.  I didn&#699;t read the dimensions before I bought them.  They are good for cutting small things but a bigger board would have been better.  It is also ver thin, so read the dimensions."
219,XX,B002M782UO,1,0,0,26-Jan-13,ALMZ70NJ42PN0,shards of wood!,We only used the large board and it started to have these shards of wood on all the food products we cut.  At first it looked like hairs in the food and then we saw it was on the board.  They look beautiful but not practical and we need to use them not look at them.  Good Price and delivered quickly but not usable.
220,XX,B002M782UO,4,0,0,19-Mar-14,A3HIB9MNIM2E0L,Decent Cutting Board Set,"A decent set of cutting boards, if a little thin. Hand wash and oil them well before first using; don't run through the dishwasher."
221,XX,B002M782UO,1,0,0,18-Mar-14,A19TOMT37JN22Z,In the trash.....,Every single one of these have cracked and I had to throw them away.  Cheap price - but I expected them to last longer.
222,XX,B002M782UO,1,0,0,17-Mar-14,A9U1OS5D00OE8,Garbage Product,"I don't often write products reviews but this is an instance where I feel it is necessary. The wife and I ordered a set of these for our kitchen and upon arriving, were thrilled at both the sizes and 'feel' of the boards. But then litteraly a day later, the bigger one of the three cracked. Now that's usually no big deal and Amazon promptly replaced it but the replacement arrived cracked. Soon after, another one of the second set cracked as well.Clearly these products are garbage."
223,XX,B002M782UO,1,0,0,16-Mar-14,A1YV9IRR7KAPH,dont waste the money,they look good  but warp like crazy...in fact the large one warped so much it has cracked...spend more on a better product.
224,XX,B002M782UO,4,0,0,14-Mar-14,A1E5Y7RFS6GH8,"Works great, try to keep dry though","These are a great little trio of boards. If they get soaking wet though, they will bow in a big way and be difficult to use, but once they dry out they straighten up. Also this may go without saying but don't put bamboo stuff in the dishwasher as it may fall apart!"
225,XX,B002M782UO,5,0,0,13-Mar-14,A1OCW44OIZ3H9R,very beautiful!,"I have these on my counter, some tipped up against the wall, and some under the coffee maker and coffee grinder.  These are really beautiful and well made.  I love them and they will make a nice addition to any kitchen."
226,XX,B002M782UO,1,0,0,11-Mar-14,AEEXJNGHGWN8X,Product Fails in 30 days or less,"After receiving the product, and using it for less than a month, the product handle cracked, and board warped!!!  My timing was bad in that I could not cal Amazon Customer Service.  Another Bamboo product I bought at Bed,Bath & Beyond still works after 1.5 years!!"
227,XX,B002M782UO,1,0,0,11-Mar-14,A32JIAYV9P5WI3,No good quality. Warped after one use,"I used the  board once. After cleaning and letting to dry, the board was completely warped. It's hard to cut something on them now. I am thinking to return it."
228,XX,B002M782UO,2,0,0,9-Mar-14,A2NIJ75GAGT953,Cheap!,"The set feels very sturdy, but the handle portion of the large board was broken by the end of day 3. We never even washed the board in the dishwasher. Probably better to buy a cutting board from your local stores."
229,XX,B002M782UO,1,0,0,9-Mar-14,A3OOGXXKTIRVUG,Broken ....,"Initially beautiful, I was excited to have the three direct sizes then....the medium sized one broken after two weeks....now I'm so sad. Buyers beware!"
230,XX,B002M782UO,4,0,0,26-Jan-13,ADYA3GU22OU60,cutting boards,"I use them every day, Very simple. Good sizes and light weight. Nothing fancy, but for the price I would recommend them. I may order another set for the RV."
231,XX,B002M782UO,5,0,0,25-Jan-13,A2GFTW25WITCOA,Great Look,"I bought these cutting boards for the loook itself.  I just got them and used them and so far it is good. However, it is really hard to complain about a product like this because it hard to find faults in cutting board.  Love the look and having mutiple cutting boards that are in different sizes is a big bonus. I never thought having 3 would be important but it is awesome.  Great Buy!!!"
232,XX,B002M782UO,5,0,0,25-Jan-13,AQCD1307TM93R,Great value,"I purchased this set of bamboo cutting boards for much less than what they cost at the local home-goods store.  I was very impressed with my purchase.  The three sizes are great for different purposes. We use the small one to put hot pots under when we want to put them on the table.  The larger two are great for cutting, and I've found that they're much easier to cut on than the plastic cutting boards.  The wood is attractive, strong, and serves the purpose.  One tip--I'd be careful with washing them, and preferably hand wash instead of putting them in the dishwasher.  They're a little delicate, and the finish gets a little bumpy with repeated wash."
233,XX,B002M782UO,4,0,0,24-Jan-13,A19W28UTP0AM0G,Good quality,"Received them and they are very good quality.  I would've like them to be a tab bigger but that's my fault for not looking at the measurements more closely.  One down fall is that they are not dishwasher safe, I hardly ever wash my dishes by hand."
234,XX,B002M782UO,5,0,0,24-Jan-13,A2OYL979ZAPP6J,Excellent,This deal was great. Love the price and the feel of it. I love bamboo so this was a great addition to the kitchen.
235,XX,B002M782UO,5,0,0,22-Jan-13,AU2EKRTHJ7753,Work great!,Can't even find the knife marks when you cut into these bamboo boards. I really like them. Nice looking and nice range in size.
236,XX,B002M782UO,5,0,0,21-Jan-13,AOIYGD2NGKAJ7,awesome,"I love these...thin, hard, easy to use...great sizes...recommend, recommend, recommend!  And, I have them hanging on my wall so they take up no space whatsoever."
237,XX,B002M782UO,5,0,0,21-Jan-13,A13CC7OZC9L7C6,Bamboo boards,Great boards and an awesome value. Much less than retail and the various sizes are great when you are chopping multiple veggies in the tour bus.
238,XX,B002M782UO,4,0,0,21-Jan-13,AX138U6ZU212W,Very hard wood,"It's been good to cut on these and when a knife hits the wood it doesn't cut into it, but be smart about it after all it is wood but bamboo is very hard and the set I have is holding up very well."
239,XX,B002M782UO,5,0,0,20-Jan-13,A3OHF7NFZ6Z4JX,Perfect cooking companion,3 Different sizes allow for a wide range of use. You can chop vegetables on one while you use another for fruit. Make sure you do not wash them in the dishwasher!
240,XX,B002M782UO,3,0,0,20-Jan-13,AQDX1J9PCV1IA,Ok if you.........,"Do not mind oiling these cutting boards everyweek. It seems like more bother than it is worth. I do like the lightweight and the feel of solid cutting surface. However if you do not oil them, the bamboo will dry out you can see that as it gets lighter in color."
241,XX,B002M782UO,5,0,0,19-Jan-13,A4UE8LZEK22II,Love it!,Great cutting boards. I wish I had found them sooner. Cleans up good and does not dull the knife! Would buy again.
242,XX,B002M782UO,5,0,0,17-Jan-13,A2O8Z4MX4I8WYT,Nice set of boards,Really like these cutting boards.  We used them to replace a set of older white plastic boards.  These are much nicer.
